{
  "_meta": {
    "schema": "tenant_status",
    "schema_version": "1.0",
    "office_code": "1371802743",
    "office_name": "ホットステーションSUN荒川",
    "service_key": "kyotaku_shien",
    "tenant_id": "care-planning",
    "as_of": "2026-04-25",
    "owner": "専務",
    "updated": "2026-05-06"
  },
  "inquiry": {
    "tokujituI_youkaigo3_ratio": {
      "current": 0.312,
      "target": 0.40,
      "numerator_current": 101,
      "denominator_current": 324,
      "needed_subtraction_for_clear": "X≧72名（地域包括紹介除外）",
      "drive_folder": "AI秘書ダッシュボード/エージェント成果物/sun_arakawa_caremgr_inquiry_full/",
      "owner_action": "ケアマネ14名へ347名分確認依頼中"
    }
  },
  "requirement_status": {
    "joukin_senjuu_cm_count": {"value": null, "status": "unknown", "note": "shared/staff.json と突合必要"},
    "shunin_cm_count": {"value": null, "status": "unknown"},
    "renkei_24h": {"status": "unknown"},
    "case_meeting_weekly": {"status": "unknown"},
    "annual_training_plan": {"status": "unknown"},
    "houkatsu_renkei": {"status": "unknown", "hint": "荒川区地域包括センターと連携実績あり（要裏取り）"},
    "kongan_jirei_ratio": {"status": "waiting", "current": 0.312, "target": 0.40, "owner": "専務"},
    "no_gensan": {"status": "unknown", "hint": "過去6ヶ月の請求明細書PDFから抽出可"},
    "kenshuu_kyouryoku": {"status": "unknown"},
    "taiin_taisho_jisseki": {"status": "unknown"},
    "terminal_care_jisseki": {"status": "unknown"},
    "taiin_taisho_annual_count": {"status": "unknown"},
    "terminal_care_annual_count": {"status": "unknown"},
    "tahoujin_jouhou_teikyou": {"status": "unknown"}
  },
  "history": [
    {"date": "2026-04-25", "event": "専務によるケアマネ14名への347名分確認依頼開始", "owner": "専務"}
  ]
}
