{
  "_meta": {
    "schema": "tenant_status",
    "schema_version": "1.0",
    "office_code": "1367197775",
    "office_name": "（内部検証用・公開禁止）",
    "service_key": "houmon_kango_kaigo",
    "tenant_id": "care-planning",
    "as_of": "2026-05-06",
    "owner": "管理者",
    "updated": "2026-05-06",
    "_visibility_note": "本ファイルは内部検証専用。公開資料には使用しない。"
  },
  "inquiry": {
    "_note": "訪問看護（介護保険）の主要加算判定に必要な情報。内部資料 products/kasan-manager/STATUS.md および skills/regulatory/HOUMON_KANGO.md を踏まえ、現状未取得のwaiting/unknown状態を初期登録。"
  },
  "requirement_status": {
    "kinkyu_houmon_todoke": {"status": "unknown", "note": "緊急時訪問看護加算の届出有無は要確認"},
    "joji_taiou_taisei": {"status": "unknown", "note": "24時間対応体制の確認待ち"},
    "kinkyu_kango_setsumei_doui": {"status": "unknown"},
    "yakan_taiou_keigen_taisei": {"status": "unknown", "note": "緊急時Ⅰ取得には夜間対応者の負担軽減取組が必要"},
    "tokubetsu_kanri_I_taisho_user": {"status": "unknown", "note": "気管カニューレ・留置カテーテル等の利用者がいるか要確認"},
    "tokubetsu_kanri_II_taisho_user": {"status": "unknown"},
    "terminal_taiou_jisseki": {"status": "unknown"},
    "terminal_keikaku": {"status": "unknown"},
    "terminal_kiroku": {"status": "unknown"},
    "terminal_kasan_zen_nendo_jisseki": {"status": "unknown", "note": "看護体制強化加算Ⅰの前年度実績要件"},
    "tokubetsu_kanri_ratio": {"status": "unknown", "note": "看護体制強化加算の特別管理加算20%以上要件"},
    "joukin_kango_ratio": {"status": "unknown", "note": "看護職員の常勤6割以上"},
    "taiou_24h": {"status": "unknown"},
    "kinzoku_7nen_kango_ratio": {"status": "unknown"},
    "kinzoku_3nen_kango_ratio": {"status": "unknown"},
    "taiin_kyoudou_jisseki": {"status": "unknown"},
    "taiin_taisho_user_type": {"status": "unknown"},
    "tankyu_shidou_jisseki": {"status": "unknown"},
    "kakutan_jisshi_kakunin": {"status": "unknown"},
    "koukuu_screening_jisshi": {"status": "unknown"},
    "shika_renkei_taisei": {"status": "unknown"},
    "shika_jouhou_teikyou": {"status": "unknown"},
    "life_submission": {"status": "unknown"},
    "life_pdca": {"status": "unknown"},
    "life_update_freq": {"status": "unknown"},
    "chingin_kaizen_keikaku": {"status": "waiting", "note": "2026-06-15届出期限・賃金改善計画書の作成必要"},
    "shugyou_kisoku_kaitei": {"status": "waiting", "note": "賃金改善が確認できる内容に改定"},
    "shokuin_shuuchi": {"status": "unknown"},
    "career_path_youken": {"status": "unknown"},
    "shokuba_kankyou_youken": {"status": "unknown"},
    "shokai_taiin_doui_jisseki": {"status": "unknown", "note": "退院日初回訪問の実績"},
    "shokai_taiin_yokujitsu_jisseki": {"status": "unknown"},
    "shinki_riyousha_status": {"status": "unknown"}
  },
  "history": [
    {"date": "2026-05-06", "event": "tenant_status初期登録（alpha.3 訪問看護 implemented化）", "owner": "管理者"}
  ]
}
